{
  "schema_version": "1.0.0",
  "audit_id": "concept-audit:synthetic-prose-strategy:v1",
  "created_at": "2026-08-31T16:30:00+02:00",
  "updated_at": "2026-08-31T16:30:00+02:00",
  "agent_contract_version": "1.1.0",
  "reconstruction_ref": "reconstruction:synthetic-prose-strategy:v1",
  "source_claim_refs": [
    "claim:synthetic-setup",
    "claim:synthetic-context"
  ],
  "construct_refs": [
    "construct:synthetic-state",
    "construct:synthetic-trigger",
    "construct:synthetic-outcome"
  ],
  "condition_map": [
    {
      "condition_id": "condition:synthetic-trigger-identity",
      "statement": "The stated trigger is part of what makes the reconstruction this source strategy rather than another strategy.",
      "classification": "STRATEGY_DEFINING",
      "origin": "SOURCE_EXPLICIT",
      "epistemic_status": "STATED",
      "source_claim_refs": ["claim:synthetic-setup"],
      "construct_refs": ["construct:synthetic-trigger"],
      "incorporation_status": "SOURCE_COMPONENT",
      "note": "This records identity, not evidence that the trigger works."
    },
    {
      "condition_id": "condition:synthetic-source-context",
      "statement": "The source says the setup is intended for the named context but does not establish that the context is necessary for success.",
      "classification": "SOURCE_STATED_APPLICATION",
      "origin": "SOURCE_EXPLICIT",
      "epistemic_status": "STATED",
      "source_claim_refs": ["claim:synthetic-context"],
      "construct_refs": ["construct:synthetic-state"],
      "incorporation_status": "SOURCE_COMPONENT",
      "note": "Application advice remains distinct from an empirically necessary condition."
    },
    {
      "condition_id": "condition:synthetic-volatility-modifier",
      "statement": "Prevailing volatility may change the size or direction of the observed response.",
      "classification": "SUSPECTED_PERFORMANCE_MODIFIER",
      "origin": "RESEARCHER_INFERENCE",
      "epistemic_status": "INFERRED",
      "source_claim_refs": [],
      "construct_refs": ["construct:synthetic-outcome"],
      "incorporation_status": "CANDIDATE_ONLY",
      "note": "It is a possible later condition hypothesis, not a hidden filter in the reconstructed strategy."
    },
    {
      "condition_id": "condition:unknown-success-conditions",
      "statement": "Further success conditions may exist but are not known from the reviewed source or the conceptual audit.",
      "classification": "UNKNOWN_SUCCESS_CONDITION",
      "origin": "UNKNOWN",
      "epistemic_status": "UNKNOWN",
      "source_claim_refs": [],
      "construct_refs": [],
      "incorporation_status": "NOT_INCORPORATED",
      "note": "The audit does not claim completeness and does not invent missing prerequisites."
    }
  ],
  "construction_dependencies": [
    {
      "dependency_id": "dependency:synthetic-shared-window",
      "from_refs": ["construct:synthetic-trigger"],
      "to_refs": ["construct:synthetic-outcome"],
      "dependency_type": "SHARED_WINDOW",
      "shared_inputs": ["the same rolling price window"],
      "statement": "Changing the shared window can change both event selection and the measured outcome.",
      "interpretation": "CHANGES_ESTIMAND_WITH_DEFINITION",
      "causal_evidence": false
    }
  ],
  "measurement_instruments": [
    {
      "instrument_id": "instrument:synthetic-state-filter",
      "construct_ref": "construct:synthetic-state",
      "purpose": "Separate observations into the source-labelled market context and its complement.",
      "input_summary": "A fixed rule computed from information available at the classification time.",
      "status": "PROVISIONAL",
      "assessment_question": "Does the fixed grouping distinguish future behavior not already used to construct the grouping?",
      "independent_future_outcomes": [
        "future directional response",
        "future path shape",
        "incremental information beyond the raw filter inputs"
      ],
      "label_prevalence_is_discrimination_evidence": false,
      "predictive_separation_establishes_real_state": false,
      "predictive_separation_establishes_cause": false,
      "failure_scope": "UNCONDITIONED_EVENT_CLAIM_MAY_REMAIN_OPEN",
      "note": "A useful partition may support a conditioned predictive claim without proving that the market contains a literal hidden state."
    }
  ],
  "mechanism_boundary": {
    "actor_status": "ABSENT",
    "mechanism_status": "UNKNOWN",
    "predictive_claim_may_exist_without_actor": true,
    "causal_interpretation_requires_separate_identification": true,
    "note": "The reconstruction may support an associational predictive question. It cannot use the state filter as evidence for an actor, intention or intervention effect."
  },
  "completeness_boundary": {
    "reviewed_scope": "Only the supplied source claims, their translated constructs and their explicit logical dependencies were reviewed.",
    "known_limitations": [
      "No claim is made that all market conditions affecting performance are known.",
      "No empirical assessment of the proposed measurement instrument was performed."
    ],
    "unknown_success_conditions_preserved": true,
    "claims_complete_knowledge": false
  },
  "audit_status": "COMPLETE",
  "overall_note": "This synthetic audit separates strategy identity, source advice, suspected modifiers and unknown conditions. It records construction dependencies and a provisional state filter without treating correlations, predictive separation or labels as causal evidence."
}
